author_id,entities/mentions/0/start,entities/mentions/0/end,entities/mentions/0/username,entities/annotations/0/start,entities/annotations/0/end,entities/annotations/0/probability,entities/annotations/0/type,entities/annotations/0/normalized_text,context_annotations/0/domain/id,context_annotations/0/domain/name,context_annotations/0/domain/description,context_annotations/0/entity/id,context_annotations/0/entity/name,text,referenced_tweets/0/type,referenced_tweets/0/id,conversation_id,id,lang,in_reply_to_user_id,reply_settings,geo/place_id,public_metrics/retweet_count,public_metrics/reply_count,public_metrics/like_count,public_metrics/quote_count,created_at,source,possibly_sensitive,entities/urls/0/start,entities/urls/0/end,entities/urls/0/url,entities/urls/0/expanded_url,entities/urls/0/display_url,entities/urls/1/start,entities/urls/1/end,entities/urls/1/url,entities/urls/1/expanded_url,entities/urls/1/display_url,entities/hashtags/0/start,entities/hashtags/0/end,entities/hashtags/0/tag,attachments/media_keys/0,attachments/media_keys/1,entities/annotations/1/start,entities/annotations/1/end,entities/annotations/1/probability,entities/annotations/1/type,entities/annotations/1/normalized_text,context_annotations/1/domain/id,context_annotations/1/domain/name,context_annotations/1/domain/description,context_annotations/1/entity/id,context_annotations/1/entity/name,context_annotations/2/domain/id,context_annotations/2/domain/name,context_annotations/2/domain/description,context_annotations/2/entity/id,context_annotations/2/entity/name,context_annotations/3/domain/id,context_annotations/3/domain/name,context_annotations/3/domain/description,context_annotations/3/entity/id,context_annotations/3/entity/name,entities/mentions/1/start,entities/mentions/1/end,entities/mentions/1/username,entities/mentions/2/start,entities/mentions/2/end,entities/mentions/2/username,entities/mentions/3/start,entities/mentions/3/end,entities/mentions/3/username,entities/mentions/4/start,entities/mentions/4/end,entities/mentions/4/username,entities/mentions/5/start,entities/mentions/5/end,entities/mentions/5/username,entities/mentions/6/start,entities/mentions/6/end,entities/mentions/6/username,entities/annotations/2/start,entities/annotations/2/end,entities/annotations/2/probability,entities/annotations/2/type,entities/annotations/2/normalized_text,entities/hashtags/1/start,entities/hashtags/1/end,entities/hashtags/1/tag,context_annotations/0/entity/description,context_annotations/1/entity/description,entities/mentions/7/start,entities/mentions/7/end,entities/mentions/7/username,entities/mentions/8/start,entities/mentions/8/end,entities/mentions/8/username,entities/mentions/9/start,entities/mentions/9/end,entities/mentions/9/username,entities/mentions/10/start,entities/mentions/10/end,entities/mentions/10/username,entities/mentions/11/start,entities/mentions/11/end,entities/mentions/11/username,entities/mentions/12/start,entities/mentions/12/end,entities/mentions/12/username,entities/mentions/13/start,entities/mentions/13/end,entities/mentions/13/username,entities/mentions/14/start,entities/mentions/14/end,entities/mentions/14/username,entities/mentions/15/start,entities/mentions/15/end,entities/mentions/15/username,entities/mentions/16/start,entities/mentions/16/end,entities/mentions/16/username,entities/mentions/17/start,entities/mentions/17/end,entities/mentions/17/username,entities/mentions/18/start,entities/mentions/18/end,entities/mentions/18/username,entities/mentions/19/start,entities/mentions/19/end,entities/mentions/19/username,entities/mentions/20/start,entities/mentions/20/end,entities/mentions/20/username,entities/mentions/21/start,entities/mentions/21/end,entities/mentions/21/username,entities/mentions/22/start,entities/mentions/22/end,entities/mentions/22/username,entities/mentions/23/start,entities/mentions/23/end,entities/mentions/23/username,entities/mentions/24/start,entities/mentions/24/end,entities/mentions/24/username,entities/mentions/25/start,entities/mentions/25/end,entities/mentions/25/username,entities/mentions/26/start,entities/mentions/26/end,entities/mentions/26/username,entities/mentions/27/start,entities/mentions/27/end,entities/mentions/27/username,entities/mentions/28/start,entities/mentions/28/end,entities/mentions/28/username,entities/mentions/29/start,entities/mentions/29/end,entities/mentions/29/username,entities/mentions/30/start,entities/mentions/30/end,entities/mentions/30/username,entities/mentions/31/start,entities/mentions/31/end,entities/mentions/31/username,entities/mentions/32/start,entities/mentions/32/end,entities/mentions/32/username,entities/mentions/33/start,entities/mentions/33/end,entities/mentions/33/username,entities/mentions/34/start,entities/mentions/34/end,entities/mentions/34/username,entities/mentions/35/start,entities/mentions/35/end,entities/mentions/35/username,entities/mentions/36/start,entities/mentions/36/end,entities/mentions/36/username,entities/mentions/37/start,entities/mentions/37/end,entities/mentions/37/username,entities/mentions/38/start,entities/mentions/38/end,entities/mentions/38/username,entities/mentions/39/start,entities/mentions/39/end,entities/mentions/39/username,entities/mentions/40/start,entities/mentions/40/end,entities/mentions/40/username,entities/mentions/41/start,entities/mentions/41/end,entities/mentions/41/username,entities/mentions/42/start,entities/mentions/42/end,entities/mentions/42/username,entities/mentions/43/start,entities/mentions/43/end,entities/mentions/43/username,entities/mentions/44/start,entities/mentions/44/end,entities/mentions/44/username,entities/mentions/45/start,entities/mentions/45/end,entities/mentions/45/username,entities/mentions/46/start,entities/mentions/46/end,entities/mentions/46/username,entities/mentions/47/start,entities/mentions/47/end,entities/mentions/47/username,entities/mentions/48/start,entities/mentions/48/end,entities/mentions/48/username,entities/mentions/49/start,entities/mentions/49/end,entities/mentions/49/username,entities/annotations/3/start,entities/annotations/3/end,entities/annotations/3/probability,entities/annotations/3/type,entities/annotations/3/normalized_text,entities/annotations/4/start,entities/annotations/4/end,entities/annotations/4/probability,entities/annotations/4/type,entities/annotations/4/normalized_text,context_annotations/3/entity/description,context_annotations/4/domain/id,context_annotations/4/domain/name,context_annotations/4/domain/description,context_annotations/4/entity/id,context_annotations/4/entity/name,context_annotations/4/entity/description,entities/hashtags/2/start,entities/hashtags/2/end,entities/hashtags/2/tag,entities/urls/2/start,entities/urls/2/end,entities/urls/2/url,entities/urls/2/expanded_url,entities/urls/2/display_url,entities/hashtags/3/start,entities/hashtags/3/end,entities/hashtags/3/tag,entities/hashtags/4/start,entities/hashtags/4/end,entities/hashtags/4/tag,entities/hashtags/5/start,entities/hashtags/5/end,entities/hashtags/5/tag,entities/hashtags/6/start,entities/hashtags/6/end,entities/hashtags/6/tag,attachments/media_keys/2,geo/coordinates/type,geo/coordinates/coordinates/0,geo/coordinates/coordinates/1
104198885,0,15,FarmaciaAhinoa,101,112,0.2852,Person,Dexametasona,123,Ongoing News Story,Ongoing News Stories like 'Brexit',1220701888179359745,COVID-19,"@FarmaciaAhinoa Buenas tardes. Por favor me puede indicar si tienen disponible:

Todex en ungüento o Dexametasona oftálmica en ungüento?",replied_to,1390689977785372672,1390689977785372672,1390747633648558084,es,913146272990810112,everyone,006a7eea485e40d9,0,1,1,0,2021-05-07T19:17:29+00:00,Twitter for Android,False,,,,,,,,,,,,,,,,,,,,,,,,,,,,,,,,,,,,,,,,,,,,,,,,,,,,,,,,,,,,,,,,,,,,,,,,,,,,,,,,,,,,,,,,,,,,,,,,,,,,,,,,,,,,,,,,,,,,,,,,,,,,,,,,,,,,,,,,,,,,,,,,,,,,,,,,,,,,,,,,,,,,,,,,,,,,,,,,,,,,,,,,,,,,,,,,,,,,,,,,,,,,,,,,,,,,,,,,,,,,,,,,,,,,,,,,,
979149295,,,,0,7,0.9941,Person,Capriles,,,,,,Capriles se erige como la gran bombona de oxígeno de usurpador genocida.,,,1390074120088522752,1390074120088522752,es,,everyone,00ea87127fecbc28,0,0,0,0,2021-05-05T22:41:11+00:00,Twitter for Android,False,,,,,,,,,,,,,,,,,,,,,,,,,,,,,,,,,,,,,,,,,,,,,,,,,,,,,,,,,,,,,,,,,,,,,,,,,,,,,,,,,,,,,,,,,,,,,,,,,,,,,,,,,,,,,,,,,,,,,,,,,,,,,,,,,,,,,,,,,,,,,,,,,,,,,,,,,,,,,,,,,,,,,,,,,,,,,,,,,,,,,,,,,,,,,,,,,,,,,,,,,,,,,,,,,,,,,,,,,,,,,,,,,,,,,,,,,
76137383,,,,,,,,,123,Ongoing News Story,Ongoing News Stories like 'Brexit',1220701888179359745,COVID-19,"🚑 El hijo de una amiga sufrió la picadura de un insecto en un ojo. Requiere los siguientes medicamentos:

-Dexametasona, 3 ampollas de 8mg.
- Dipirona, 1 ampolla de 1mg.
- Alergot o Azelastina en gotas.
- Loratadina en jarabe.
- Acetaminofen en jarabe.

#SanCristobal https://t.co/7Rl1EevZnY",,,1387458337034444801,1387458337034444801,es,,everyone,01a73d6169f504ac,17,2,1,0,2021-04-28T17:26:59+00:00,Twitter for Android,False,268,291,https://t.co/7Rl1EevZnY,https://twitter.com/pedroluisduque/status/1387458337034444801/photo/1,pic.twitter.com/7Rl1EevZnY,268,291,https://t.co/7Rl1EevZnY,https://twitter.com/pedroluisduque/status/1387458337034444801/photo/1,pic.twitter.com/7Rl1EevZnY,254,267,SanCristobal,31387458327093944327,31387458332261298180,,,,,,,,,,,,,,,,,,,,,,,,,,,,,,,,,,,,,,,,,,,,,,,,,,,,,,,,,,,,,,,,,,,,,,,,,,,,,,,,,,,,,,,,,,,,,,,,,,,,,,,,,,,,,,,,,,,,,,,,,,,,,,,,,,,,,,,,,,,,,,,,,,,,,,,,,,,,,,,,,,,,,,,,,,,,,,,,,,,,,,,,,,,,,,,,,,,,,,,,,,,,,,,,,,,,,,,,,,
1604386350,,,,,,,,,,,,,,Buenos días quien tenga información exacta y no precios tan abruptos para recargar Bombona de oxígeno se le agradece por la información se necesita para un vecino de otra Urbanización cercana a la que vivo,,,1385950786207850501,1385950786207850501,es,,everyone,015d19216c749864,0,1,0,0,2021-04-24T13:36:31+00:00,Twitter for Android,False,,,,,,,,,,,,,,,,,,,,,,,,,,,,,,,,,,,,,,,,,,,,,,,,,,,,,,,,,,,,,,,,,,,,,,,,,,,,,,,,,,,,,,,,,,,,,,,,,,,,,,,,,,,,,,,,,,,,,,,,,,,,,,,,,,,,,,,,,,,,,,,,,,,,,,,,,,,,,,,,,,,,,,,,,,,,,,,,,,,,,,,,,,,,,,,,,,,,,,,,,,,,,,,,,,,,,,,,,,,,,,,,,,,,,,,,,
1339999143733972993,0,16,VirguezFranklin,,,,,,,,,,,"@VirguezFranklin Reflexione!!  Quienes son los reales genocidas ? ... 1 bombona de oxígeno costaba 40$ y ahora 400$.... salud. Una harina pan costaba 0,70$ ahora 1,20$ Comida ...genocida es el gobierno o somos nosotros mismos !  Maldito oportunismo CRIOLLO ! Ven por qué ? No cae el sistema ! 🔺🔺",replied_to,1385943063185481730,1385943063185481730,1385950152276549633,es,539280264,everyone,0198c6f108778b40,0,0,0,0,2021-04-24T13:34:00+00:00,Twitter for Android,False,,,,,,,,,,,,,,,,,,,,,,,,,,,,,,,,,,,,,,,,,,,,,,,,,,,,,,,,,,,,,,,,,,,,,,,,,,,,,,,,,,,,,,,,,,,,,,,,,,,,,,,,,,,,,,,,,,,,,,,,,,,,,,,,,,,,,,,,,,,,,,,,,,,,,,,,,,,,,,,,,,,,,,,,,,,,,,,,,,,,,,,,,,,,,,,,,,,,,,,,,,,,,,,,,,,,,,,,,,,,,,,,,,,,,,,,,
1339999143733972993,,,,,,,,,,,,,,"Reflexione!!  Quienes son los reales genocidas ? ... 1 bombona de oxígeno costaba 40$ y ahora 400$.... salud. Una harina pan costaba 0,70$ ahora 1,20$ Comida ...genocida es el gobierno o somos nosotros mismos !  Maldito oportunismo CRIOLLO ! Ven por qué ? No cae el sistema ! 🔺🔺",,,1385947916188233729,1385947916188233729,es,,everyone,0198c6f108778b40,0,0,5,0,2021-04-24T13:25:07+00:00,Twitter for Android,False,,,,,,,,,,,,,,,,,,,,,,,,,,,,,,,,,,,,,,,,,,,,,,,,,,,,,,,,,,,,,,,,,,,,,,,,,,,,,,,,,,,,,,,,,,,,,,,,,,,,,,,,,,,,,,,,,,,,,,,,,,,,,,,,,,,,,,,,,,,,,,,,,,,,,,,,,,,,,,,,,,,,,,,,,,,,,,,,,,,,,,,,,,,,,,,,,,,,,,,,,,,,,,,,,,,,,,,,,,,,,,,,,,,,,,,,,
1388509382,,,,117,132,0.8772,Place,Terrazas del mar,,,,,,"Muchos pagan lo que no tienen por una bombona de oxigeno...Ya son tres días quemando nuestro pulmón Vegetal frente a Terrazas del mar y Guadalupe, via el Rincón y Nadie hace nada. https://t.co/2rkMmhOdzU",,,1385233720173543426,1385233720173543426,es,,everyone,018deff91b0b23b7,0,0,0,0,2021-04-22T14:07:09+00:00,Twitter for Android,False,180,203,https://t.co/2rkMmhOdzU,https://twitter.com/Yadira_Virgo/status/1385233720173543426/photo/1,pic.twitter.com/2rkMmhOdzU,,,,,,,,,31385233673830739971,,136,144,0.6676,Place,Guadalupe,,,,,,,,,,,,,,,,,,,,,,,,,,,,,,,,,,,,,,,,,,,,,,,,,,,,,,,,,,,,,,,,,,,,,,,,,,,,,,,,,,,,,,,,,,,,,,,,,,,,,,,,,,,,,,,,,,,,,,,,,,,,,,,,,,,,,,,,,,,,,,,,,,,,,,,,,,,,,,,,,,,,,,,,,,,,,,,,,,,,,,,,,,,,,,,,,,,,,,,,,,,,,,,,,,,,,
116740158,,,,54,65,0.9729,Person,Carla Angola,10,Person,Named people in the world like Nelson Mandela,1138091602587504642,Carla Angola,"#ServicioPublico

Se solicita bombona de oxigeno para Carla Angola.
Se la pueden llevar a su cuenta tuiter.",,,1385033332069634048,1385033332069634048,es,,everyone,0032a06455f7e1ea,0,0,2,0,2021-04-22T00:50:53+00:00,Twitter for Android,False,,,,,,,,,,,0,16,ServicioPublico,,,,,,,,46,Brand Category,Categories within Brand Verticals that narrow down the scope of Brands,781974596752842752,Services,47,Brand,Brands and Companies,10045225402,Twitter,94,Journalist,A journalist like 'Anderson Cooper',1138091602587504642,Carla Angola,,,,,,,,,,,,,,,,,,,,,,,,,,,,,,,,,,,,,,,,,,,,,,,,,,,,,,,,,,,,,,,,,,,,,,,,,,,,,,,,,,,,,,,,,,,,,,,,,,,,,,,,,,,,,,,,,,,,,,,,,,,,,,,,,,,,,,,,,,,,,,,,,,,,,,,,,,,,,,,,,,,,,,,,,,,,,,,,,,,,,,,,,,,,,,,,,,,,,,
1148633257526870016,0,16,LuisOlavarrieta,37,46,0.3634,Place,Cisplatino,123,Ongoing News Story,Ongoing News Stories like 'Brexit',1220701888179359745,COVID-19,"@LuisOlavarrieta @mich_vr Disponible Cisplatino, dexametasona, ondasetron Contacto vía WhatsApp +58 414-2539068",replied_to,1384611196360351744,1384611196360351744,1384649013748805633,es,109057415,everyone,01bc41ac40f6f2ff,1,0,2,0,2021-04-20T23:23:45+00:00,Twitter for Android,False,,,,,,,,,,,,,,,,87,94,0.8477,Product,WhatsApp,,,,,,,,,,,,,,,,17,25,mich_vr,,,,,,,,,,,,,,,,,,,,,,,,,,,,,,,,,,,,,,,,,,,,,,,,,,,,,,,,,,,,,,,,,,,,,,,,,,,,,,,,,,,,,,,,,,,,,,,,,,,,,,,,,,,,,,,,,,,,,,,,,,,,,,,,,,,,,,,,,,,,,,,,,,,,,,,,,,,,,,,,,,,,,,,,,,,,,,,,,,,,,,,,,,,,,,,,,,,
1148633257526870016,0,14,DUINCONSUELOC,,,,,,123,Ongoing News Story,Ongoing News Stories like 'Brexit',1220701888179359745,COVID-19,"@DUINCONSUELOC @MGVenezuela Dexametasona de 8 ml $2,50 cada ampolla",replied_to,1384010739023638535,1383985341426585604,1384144496951103499,pt,2463836414,everyone,01bc41ac40f6f2ff,0,0,0,0,2021-04-19T13:58:58+00:00,Twitter for Android,False,,,,,,,,,,,,,,,,,,,,,,,,,,,,,,,,,,,,15,27,MGVenezuela,,,,,,,,,,,,,,,,,,,,,,,,,,,,,,,,,,,,,,,,,,,,,,,,,,,,,,,,,,,,,,,,,,,,,,,,,,,,,,,,,,,,,,,,,,,,,,,,,,,,,,,,,,,,,,,,,,,,,,,,,,,,,,,,,,,,,,,,,,,,,,,,,,,,,,,,,,,,,,,,,,,,,,,,,,,,,,,,,,,,,,,,,,,,,,,,,,,
81227712,0,11,LLIANKTIRA,37,39,0.8923,Organization,OMS,123,Ongoing News Story,Ongoing News Stories like 'Brexit',1220701888179359745,COVID-19,"@LLIANKTIRA Sí, cierto. Hace poco la OMS señaló que ese medicamento (que es un antiparasitario) no tiene ningún efecto en los pacientes con covid y pidió dejar de usarlo, al igual que la dexametasona y la hidrocloroquina.",replied_to,1383908600230277121,1383906299931283456,1383914024794947590,es,108825957,everyone,004ea55b013fa89f,1,1,3,0,2021-04-18T22:43:10+00:00,Twitter for Android,False,,,,,,,,,,,,,,,,,,,,,,,,,,,,,,,,,,,,,,,,,,,,,,,,,,,,,,,,,,,,,,,,,,,,,,,,,,,,,,,,,,,,,,,,,,,,,,,,,,,,,,,,,,,,,,,,,,,,,,,,,,,,,,,,,,,,,,,,,,,,,,,,,,,,,,,,,,,,,,,,,,,,,,,,,,,,,,,,,,,,,,,,,,,,,,,,,,,,,,,,,,,,,,,,,,,,,,,,,,,,,,,,,,,,,,,,,
132371425,,,,114,123,0.859,Place,Maracaibo,,,,,,"Buenas noches, por favor quien me puede colaborar e informarme donde se puede conseguir una bombona de oxígeno en 
Maracaibo,  gracias",,,1383587787950067723,1383587787950067723,es,,everyone,01be351754bcbe13,0,0,0,0,2021-04-18T01:06:49+00:00,Twitter for Android,False,,,,,,,,,,,,,,,,,,,,,,,,,,,,,,,,,,,,,,,,,,,,,,,,,,,,,,,,,,,,,,,,,,,,,,,,,,,,,,,,,,,,,,,,,,,,,,,,,,,,,,,,,,,,,,,,,,,,,,,,,,,,,,,,,,,,,,,,,,,,,,,,,,,,,,,,,,,,,,,,,,,,,,,,,,,,,,,,,,,,,,,,,,,,,,,,,,,,,,,,,,,,,,,,,,,,,,,,,,,,,,,,,,,,,,,,,
81227712,,,,49,51,0.9553,Organization,OMS,10,Person,Named people in the world like Nelson Mandela,1138104384351399937,Diosdado Cabello R,"Ampolla con ye de yoyo 😱😱😱😱.

Por cierto, la OMS desestimó la efectividad de la dexametasona para tratar la covid, así como el antiparasitario ivermectina. https://t.co/qJxLDzSCLv",quoted,1383247467076980740,1383387612757381128,1383387612757381128,es,,everyone,01c93e351e3122fb,0,1,0,0,2021-04-17T11:51:23+00:00,Twitter for Android,False,156,179,https://t.co/qJxLDzSCLv,https://twitter.com/Johana78145473/status/1383247467076980740,twitter.com/Johana78145473…,,,,,,,,,,,,,,,,35,Politician,"Politicians in the world, like Joe Biden",1138104384351399937,Diosdado Cabello R,123,Ongoing News Story,Ongoing News Stories like 'Brexit',1220701888179359745,COVID-19,,,,,,,,,,,,,,,,,,,,,,,,,,,,,,,,,,,,,,,,,,,,,,,,,,,,,,,,,,,,,,,,,,,,,,,,,,,,,,,,,,,,,,,,,,,,,,,,,,,,,,,,,,,,,,,,,,,,,,,,,,,,,,,,,,,,,,,,,,,,,,,,,,,,,,,,,,,,,,,,,,,,,,,,,,,,,,,,,,,,,,,,,,,,,,,,,,,,,,,,,,,
1148633257526870016,0,12,MGVenezuela,178,185,0.6343,Product,WhatsApp,123,Ongoing News Story,Ongoing News Stories like 'Brexit',1220701888179359745,COVID-19,@MGVenezuela @PublServ @farmarebajas @FarmaciaWuiston @Farmarato @SOSDonaciones @DonaMed_VE Disponible Clexane de 40 mg x 2 ampollas y Dexametasona de 8 MG/2 ml. Contáctenos vía WhatsApp al número +58 414-2539068,replied_to,1383148242083270656,1383144191044243462,1383204831519723521,es,558946320,everyone,01bc41ac40f6f2ff,6,1,1,0,2021-04-16T23:45:05+00:00,Twitter for Android,False,,,,,,,,,,,,,,,,,,,,,,,,,,,,,,,,,,,,13,22,PublServ,23,36,farmarebajas,37,53,FarmaciaWuiston,54,64,Farmarato,65,79,SOSDonaciones,80,91,DonaMed_VE,,,,,,,,,,,,,,,,,,,,,,,,,,,,,,,,,,,,,,,,,,,,,,,,,,,,,,,,,,,,,,,,,,,,,,,,,,,,,,,,,,,,,,,,,,,,,,,,,,,,,,,,,,,,,,,,,,,,,,,,,,,,,,,,,,,,,,,,,,,,,,,,,,,,,,,,,,,,,,,,,,,,,,,,,,,,,,,,,,,,
114622258,,,,,,,,,123,Ongoing News Story,Ongoing News Stories like 'Brexit',1220701888179359745,COVID-19,"Que médicamento es su santo grial? Para mí por mucho la Dexametasona, son demasiados los usos que tiene, claro sin hacer su uso abusivo y prolongado.",,,1383172111632633856,1383172111632633856,es,,everyone,01c93e351e3122fb,2,8,17,3,2021-04-16T21:35:04+00:00,Twitter for Android,False,,,,,,,,,,,,,,,,,,,,,,,,,,,,,,,,,,,,,,,,,,,,,,,,,,,,,,,,,,,,,,,,,,,,,,,,,,,,,,,,,,,,,,,,,,,,,,,,,,,,,,,,,,,,,,,,,,,,,,,,,,,,,,,,,,,,,,,,,,,,,,,,,,,,,,,,,,,,,,,,,,,,,,,,,,,,,,,,,,,,,,,,,,,,,,,,,,,,,,,,,,,,,,,,,,,,,,,,,,,,,,,,,,,,,,,,,
67153643,,,,29,39,0.9791,Person,Luis Dávila,,,,,,"#ServicioPúblico El profesor Luis Dávila del CP Jesús Ma Marrero de #Guarenas requiere ayuda económica para costear los medicamentos y la recarga de la bombona de oxígeno que, gracias a Dios, su familia ya le consiguió. Cualquier aporte, por pequeño q sea, cuenta y vale mucho ❤️ https://t.co/6dYq1sb54J",,,1382706242792079363,1382706242792079363,es,,everyone,00dd051c4ae032b0,39,1,10,2,2021-04-15T14:43:52+00:00,Twitter for Android,False,280,303,https://t.co/6dYq1sb54J,https://twitter.com/LidkRodelo/status/1382706242792079363/photo/1,pic.twitter.com/6dYq1sb54J,,,,,,0,16,ServicioPúblico,31382706235594702863,,48,63,0.9322,Person,Jesús Ma Marrero,,,,,,,,,,,,,,,,,,,,,,,,,,,,,,,,,,186,189,0.9368,Other,Dios,68,77,Guarenas,,,,,,,,,,,,,,,,,,,,,,,,,,,,,,,,,,,,,,,,,,,,,,,,,,,,,,,,,,,,,,,,,,,,,,,,,,,,,,,,,,,,,,,,,,,,,,,,,,,,,,,,,,,,,,,,,,,,,,,,,,,,,,,,,,,,,,,,,,,,,,,,,,,,,,,,,,,,,,,,,,,,,,,,,,,,
196843793,0,11,rigotordoc,,,,,,123,Ongoing News Story,Ongoing News Stories like 'Brexit',1220701888179359745,COVID-19,"@rigotordoc @santiagobacci Hoy me piden opinión acerca de un caso no conocido. MC fiebre, malestar, tos. Consulta un neumonologo:eco pulmonar Dx neumonía covid19. No lab, no imágenes radiográficas. Tto: favipiravir+lomefloxacina+ Dexametasona+fraxiparina + Aspirina. Todo primera consulta. No hay derecho.",replied_to,1382527643233488906,1382157382554427397,1382534032592896001,es,40703088,everyone,012af435641420c7,0,1,1,2,2021-04-15T03:19:34+00:00,Twitter for Android,False,,,,,,,,,,,,,,,,,,,,,,,,,,,,,,,,,,,,12,26,santiagobacci,,,,,,,,,,,,,,,,,,,,,,,,,,,,,,,,,,,,,,,,,,,,,,,,,,,,,,,,,,,,,,,,,,,,,,,,,,,,,,,,,,,,,,,,,,,,,,,,,,,,,,,,,,,,,,,,,,,,,,,,,,,,,,,,,,,,,,,,,,,,,,,,,,,,,,,,,,,,,,,,,,,,,,,,,,,,,,,,,,,,,,,,,,,,,,,,,,,
1148633257526870016,54,70,BuscandoMedicin,,,,,,123,Ongoing News Story,Ongoing News Stories like 'Brexit',1220701888179359745,COVID-19,"Disponible Dexametasona 8mg/2ml en $2,5 cada ampolla. @BuscandoMedicin #dexametasona #farmaciaesenciavital https://t.co/Y65eQrOSgw",,,1382051668875997190,1382051668875997190,es,,everyone,01bc41ac40f6f2ff,4,1,3,0,2021-04-13T19:22:49+00:00,Twitter for Android,False,107,130,https://t.co/Y65eQrOSgw,https://twitter.com/FarmaciaeVital/status/1382051668875997190/photo/1,pic.twitter.com/Y65eQrOSgw,,,,,,71,84,dexametasona,31382051666384539657,,,,,,,,,,,,,,,,,,,,,,,,,,,,,,,,,,,,,,,,,,,,,85,106,farmaciaesenciavital,,,,,,,,,,,,,,,,,,,,,,,,,,,,,,,,,,,,,,,,,,,,,,,,,,,,,,,,,,,,,,,,,,,,,,,,,,,,,,,,,,,,,,,,,,,,,,,,,,,,,,,,,,,,,,,,,,,,,,,,,,,,,,,,,,,,,,,,,,,,,,,,,,,,,,,,,,,,,,,,,,,,,,,,,,,,
185410016,,,,93,99,0.9959,Place,Caracas,,,,,,"Hola amigos nuevamente paso por acá por su ayuda. Tengo 2 bombonas de oxígeno en alquiler en Caracas, eran de mi abuelo pero lo tuvimos que hospitalizar, aún necesitamos costear los gastos de medicamentos y exámenes. Si conocen a alguien que esté en búsqueda de una bombona 1/2",,,1381777458299604996,1381777458299604996,es,,everyone,0137799d4f960b21,110,9,42,3,2021-04-13T01:13:12+00:00,Twitter for iPhone,False,,,,,,,,,,,,,,,,,,,,,,,,,,,,,,,,,,,,,,,,,,,,,,,,,,,,,,,,,,,,,,,,,,,,,,,,,,,,,,,,,,,,,,,,,,,,,,,,,,,,,,,,,,,,,,,,,,,,,,,,,,,,,,,,,,,,,,,,,,,,,,,,,,,,,,,,,,,,,,,,,,,,,,,,,,,,,,,,,,,,,,,,,,,,,,,,,,,,,,,,,,,,,,,,,,,,,,,,,,,,,,,,,,,,,,,,,
1362504622238228498,0,15,ElRatonJodedor,,,,,,,,,,,@ElRatonJodedor Hay q decirles los arrechos respiran sin bombona de oxigeno  puuyalooo!!!,replied_to,1379531086833856515,1379531086833856515,1379535181594382341,es,862726069396393985,everyone,01a74227630d48a8,0,0,4,0,2021-04-06T20:43:12+00:00,Twitter for Android,False,,,,,,,,,,,,,,,,,,,,,,,,,,,,,,,,,,,,,,,,,,,,,,,,,,,,,,,,,,,,,,,,,,,,,,,,,,,,,,,,,,,,,,,,,,,,,,,,,,,,,,,,,,,,,,,,,,,,,,,,,,,,,,,,,,,,,,,,,,,,,,,,,,,,,,,,,,,,,,,,,,,,,,,,,,,,,,,,,,,,,,,,,,,,,,,,,,,,,,,,,,,,,,,,,,,,,,,,,,,,,,,,,,,,,,,,,
94601036,,,,,,,,,,,,,,"La doctora que revisó a mi papá me dijo: Te doy 2 opciones, o consigues una bombona de oxigeno YA, o lo tenemos que hospitalizar de inmediato. Afortunadamente pudimos cumplir con la 1era. Mi solidaridad con todos los que se encuentran en los hospitales batallando.",,,1379507510512599050,1379507510512599050,es,,everyone,00ec4c32070f5076,0,0,4,0,2021-04-06T18:53:15+00:00,Twitter for Android,False,,,,,,,,,,,,,,,,,,,,,,,,,,,,,,,,,,,,,,,,,,,,,,,,,,,,,,,,,,,,,,,,,,,,,,,,,,,,,,,,,,,,,,,,,,,,,,,,,,,,,,,,,,,,,,,,,,,,,,,,,,,,,,,,,,,,,,,,,,,,,,,,,,,,,,,,,,,,,,,,,,,,,,,,,,,,,,,,,,,,,,,,,,,,,,,,,,,,,,,,,,,,,,,,,,,,,,,,,,,,,,,,,,,,,,,,,
107751167,,,,18,24,0.9936,Place,Caracas,123,Ongoing News Story,Ongoing News Stories like 'Brexit',1220701888179359745,COVID-19,"Buscar Oxígeno en Caracas es Misión Imposible y la nueva modalidad para estafar a los familiares de los enfermos de COVID19, el alquiler de una bombona puede costar 120$ semanales fácilmente y eso sin contar los gastos de alimentos y medicinas.",,,1379210691027070978,1379210691027070978,es,,everyone,00fef4361f2ad538,1,0,1,0,2021-04-05T23:13:47+00:00,Twitter for Android,False,,,,,,,,,,,,,,,,116,122,0.4444,Organization,COVID19,,,,,,,,,,,,,,,,,,,,,,,,,,,,,,,,,,,,,,,,,,,,,,,,,,,,,,,,,,,,,,,,,,,,,,,,,,,,,,,,,,,,,,,,,,,,,,,,,,,,,,,,,,,,,,,,,,,,,,,,,,,,,,,,,,,,,,,,,,,,,,,,,,,,,,,,,,,,,,,,,,,,,,,,,,,,,,,,,,,,,,,,,,,,,,,,,,,,,,,,,,,,,,,,,,,,,
40647108,0,14,Edurodriguezg,,,,,,123,Ongoing News Story,Ongoing News Stories like 'Brexit',1220701888179359745,COVID-19,"@Edurodriguezg #Atiempo buenos días, me pregunto donde están todas esas pruebas rápidas y de PCR que han llegado por toneladas al país? Puede el ciudadano común pagar $60 por una PCR? $450 x bombona de oxígeno? $50 x recarga? La gente morirá en sus casas, triste realidad",,,1379020743506337793,1379020743506337793,es,108722247,everyone,00ec4c32070f5076,0,0,0,0,2021-04-05T10:39:00+00:00,Twitter for Android,False,,,,,,,,,,,15,23,Atiempo,,,,,,,,,,,,,,,,,,,,,,,,,,,,,,,,,,,,,,,,,,,,,,,,,,,,,,,,,,,,,,,,,,,,,,,,,,,,,,,,,,,,,,,,,,,,,,,,,,,,,,,,,,,,,,,,,,,,,,,,,,,,,,,,,,,,,,,,,,,,,,,,,,,,,,,,,,,,,,,,,,,,,,,,,,,,,,,,,,,,,,,,,,,,,,,,,,,,,,,,,,,,,,,,,,,,,,,,,,,,
1261327718106398722,0,14,NicolasMaduro,28,33,0.9473,Person,Maduro,10,Person,Named people in the world like Nelson Mandela,839575776999583745,Nicolás Maduro,"@NicolasMaduro Mi Sr. Pdte. Maduro, muy Buenas Noches!  Agradezco de antemano, su valioso apoyo incondicional, es para mí una Bombona. oxígeno, ya q mi Quincena No logra cubrir mis necesidades ! Tengo a mi mamá con Marca paso y tratamiento intenso! ❤️🙏🙏❤️❤️",,,1378889522671419393,1378889522671419393,es,1252764865,everyone,012b6b2c110f0c21,0,0,0,0,2021-04-05T01:57:35+00:00,Twitter for Android,False,,,,,,,,,,,,,,,,,,,,,35,Politician,"Politicians in the world, like Joe Biden",839575776999583745,Nicolás Maduro,,,,,,,,,,,,,,,,,,,,,,,,,,,,,,,,,,,,,President of Venezuela Nicolás Maduro,President of Venezuela Nicolás Maduro,,,,,,,,,,,,,,,,,,,,,,,,,,,,,,,,,,,,,,,,,,,,,,,,,,,,,,,,,,,,,,,,,,,,,,,,,,,,,,,,,,,,,,,,,,,,,,,,,,,,,,,,,,,,,,,,,,,,,,,,,,,,,,,,,,,,,,,,,,,,,,,,,,,,,,,,,,,,,,,,,,,,,,,,,,
